{
 "field": {
  "uid": "tr-115077081",
  "window": "traun_enns",
  "area_ha": 9.58,
  "centroid_lonlat": [
   14.40787,
   48.13057
  ],
  "ref_year": 2025
 },
 "coverage": {
  "years": [
   2019,
   2020,
   2021,
   2022,
   2023,
   2024,
   2025
  ],
  "declared_years": 7,
  "s2_clear_obs_per_year": {
   "2019": 40.0,
   "2020": 48.0,
   "2021": 34.0,
   "2022": 45.0,
   "2023": 41.0,
   "2024": 37.0,
   "2025": 50.0
  },
  "tessera_px": 844
 },
 "history": [
  {
   "year": 2019,
   "declared": "WINTER BARLEY",
   "group": "winter cereal",
   "embedding_group": "winter cereal",
   "p_declared_group": 1.0,
   "yoy_centred_distance": null,
   "phenology_change": null,
   "declared_change": null,
   "flags": []
  },
  {
   "year": 2020,
   "declared": "SUGAR BEET",
   "group": "sugar beet",
   "embedding_group": "sugar beet",
   "p_declared_group": 1.0,
   "yoy_centred_distance": 0.639,
   "phenology_change": true,
   "declared_change": true,
   "flags": []
  },
  {
   "year": 2021,
   "declared": "WINTER SOFT WHEAT",
   "group": "winter cereal",
   "embedding_group": "winter cereal",
   "p_declared_group": 1.0,
   "yoy_centred_distance": 1.239,
   "phenology_change": true,
   "declared_change": true,
   "flags": []
  },
  {
   "year": 2022,
   "declared": "SOYBEANS",
   "group": "legume",
   "embedding_group": "legume",
   "p_declared_group": 1.0,
   "yoy_centred_distance": 1.121,
   "phenology_change": true,
   "declared_change": true,
   "flags": []
  },
  {
   "year": 2023,
   "declared": "SOYBEANS",
   "group": "legume",
   "embedding_group": "legume",
   "p_declared_group": 0.991,
   "yoy_centred_distance": 0.152,
   "phenology_change": false,
   "declared_change": false,
   "flags": []
  },
  {
   "year": 2024,
   "declared": "WINTER BARLEY",
   "group": "winter cereal",
   "embedding_group": "winter cereal",
   "p_declared_group": 0.973,
   "yoy_centred_distance": 0.87,
   "phenology_change": true,
   "declared_change": true,
   "flags": []
  },
  {
   "year": 2025,
   "declared": "GRAIN CORN",
   "group": "maize",
   "embedding_group": "maize",
   "p_declared_group": 0.998,
   "yoy_centred_distance": 1.103,
   "phenology_change": true,
   "declared_change": true,
   "flags": []
  }
 ],
 "rotation_profile": {
  "n_years": 7,
  "cereal_share": 0.43,
  "n_crops": 5,
  "group_entropy_bits": 1.84,
  "max_monoculture_run": 2,
  "declared_changes": 5,
  "embedding_changes": 5,
  "disagreements": 0,
  "percentile_in_window": {
   "cereal_share": 0.49,
   "group_entropy": 0.71
  }
 },
 "management": [
  {
   "year": 2019,
   "sos_doy": 86.0,
   "peak_doy": 116.0,
   "harvest_doy": 181.0,
   "season_len_d": 85.0,
   "n_cycles": 2.0,
   "winter_cover": "green",
   "winter_green_kind": "cover/catch",
   "bare_soil_days": 85.0
  },
  {
   "year": 2020,
   "sos_doy": 156.0,
   "peak_doy": 196.0,
   "harvest_doy": 286.0,
   "season_len_d": 120.0,
   "n_cycles": 1.0,
   "winter_cover": "n/a",
   "winter_green_kind": null,
   "bare_soil_days": 100.0
  },
  {
   "year": 2021,
   "sos_doy": 65.0,
   "peak_doy": 165.0,
   "harvest_doy": 200.0,
   "season_len_d": 125.0,
   "n_cycles": 1.0,
   "winter_cover": "bare",
   "winter_green_kind": null,
   "bare_soil_days": 160.0
  },
  {
   "year": 2022,
   "sos_doy": 160.0,
   "peak_doy": 215.0,
   "harvest_doy": 300.0,
   "season_len_d": 115.0,
   "n_cycles": 1.0,
   "winter_cover": "n/a",
   "winter_green_kind": null,
   "bare_soil_days": 165.0
  },
  {
   "year": 2023,
   "sos_doy": 200.0,
   "peak_doy": 240.0,
   "harvest_doy": 280.0,
   "season_len_d": 70.0,
   "n_cycles": 1.0,
   "winter_cover": "n/a",
   "winter_green_kind": null,
   "bare_soil_days": 245.0
  },
  {
   "year": 2024,
   "sos_doy": 55.0,
   "peak_doy": 135.0,
   "harvest_doy": 190.0,
   "season_len_d": 130.0,
   "n_cycles": 0.0,
   "winter_cover": "green",
   "winter_green_kind": "cover/catch",
   "bare_soil_days": 75.0
  },
  {
   "year": 2025,
   "sos_doy": 194.0,
   "peak_doy": 219.0,
   "harvest_doy": 289.0,
   "season_len_d": 85.0,
   "n_cycles": 1.0,
   "winter_cover": "n/a",
   "winter_green_kind": null,
   "bare_soil_days": 80.0
  }
 ],
 "performance": {
  "by_year": [
   {
    "year": 2019,
    "crop": "WINTER BARLEY",
    "indvi_season": 54.3,
    "pct_vs_peers": 0.21,
    "z_peer": -0.92,
    "peak_ndvi_pct": 0.12,
    "peak_timing_vs_peers_z": 0.0,
    "n_peers": 54
   },
   {
    "year": 2020,
    "crop": "SUGAR BEET",
    "indvi_season": 77.1,
    "pct_vs_peers": 0.15,
    "z_peer": -1.21,
    "peak_ndvi_pct": 0.92,
    "peak_timing_vs_peers_z": -0.22,
    "n_peers": 60
   },
   {
    "year": 2021,
    "crop": "WINTER SOFT WHEAT",
    "indvi_season": 68.9,
    "pct_vs_peers": 0.81,
    "z_peer": 1.42,
    "peak_ndvi_pct": 0.33,
    "peak_timing_vs_peers_z": 0.67,
    "n_peers": 148
   },
   {
    "year": 2022,
    "crop": "SOYBEANS",
    "indvi_season": 66.7,
    "pct_vs_peers": 0.99,
    "z_peer": 2.0,
    "peak_ndvi_pct": 0.42,
    "peak_timing_vs_peers_z": 0.0,
    "n_peers": 80
   },
   {
    "year": 2023,
    "crop": "SOYBEANS",
    "indvi_season": 42.7,
    "pct_vs_peers": 0.42,
    "z_peer": -0.22,
    "peak_ndvi_pct": 0.85,
    "peak_timing_vs_peers_z": 2.7,
    "n_peers": 96
   },
   {
    "year": 2024,
    "crop": "WINTER BARLEY",
    "indvi_season": 34.4,
    "pct_vs_peers": 0.02,
    "z_peer": -1.75,
    "peak_ndvi_pct": 0.02,
    "peak_timing_vs_peers_z": 0.67,
    "n_peers": 43
   },
   {
    "year": 2025,
    "crop": "GRAIN CORN",
    "indvi_season": 55.7,
    "pct_vs_peers": 0.07,
    "z_peer": -1.6,
    "peak_ndvi_pct": 0.59,
    "peak_timing_vs_peers_z": 2.7,
    "n_peers": 76
   }
  ],
  "summary": {
   "n_years": 7,
   "mean_pct": 0.38,
   "years_bottom_quartile": 4,
   "years_top_quartile": 2,
   "caveat": "field effect is weak (A3 ICC ~0.1) and does not carry across crop changes; read single-year percentiles as season outcomes"
  }
 },
 "within_field": {
  "n_px": 844,
  "n_years": 7,
  "stability_rho": 0.431,
  "split_half_rho": 0.634,
  "persistent_low_frac": 0.059,
  "persistent_low_expected_by_chance": 0.0047,
  "low_zone_direction": "E",
  "terrain": {
   "rho_elevation": 0.249,
   "rho_twi": 0.292,
   "rho_elevation_rotated_null": -0.438,
   "relief_m": 14.5
  }
 },
 "anomalies": [
  {
   "year": 2024,
   "traj_dev_season_z": 7.44,
   "emb_dev_z": 1.65,
   "events": [
    "low_peak"
   ]
  },
  {
   "year": 2025,
   "traj_dev_season_z": 8.46,
   "emb_dev_z": 1.41,
   "events": []
  }
 ],
 "boundary": {
  "pred_year": 2025,
  "pred_best_iou": 0.946,
  "pred_split": false,
  "pred_block_ratio": 0.95,
  "note": "PRUE delineates field blocks; low IoU with ratio >1.5 = merged with neighbours (A6), not a data error"
 },
 "maci": {
  "status": "PLACEHOLDER: 'MACI time series' undefined; awaiting Julian"
 },
 "evidence": {
  "history": "A1 (rotation AUC, LOYO group acc)",
  "management": "A2 (harvest vs calendar, cycles vs multi-crop, winter-cover persistence)",
  "performance": "A3 (peer percentile; field-effect ICC, crop-change caveat)",
  "within_field": "A4 (zone stability, edge control, binomial null, DEM rotated null)",
  "anomalies": "A5 (blinded curve review; in-season score)",
  "boundary": "A6 (PRUE vs declared)"
 },
 "narrative": "Declared 2019 winter barley -> 2020 sugar beet -> 2021 winter soft wheat -> 2022 soybeans -> 2023 soybeans -> 2024 winter barley -> 2025 grain corn. 5 crops in 7 declared years, cereal share 43%, longest same-crop run 2y; 0 declared-vs-phenology disagreement(s). After summer harvest the field was green over winter in 2/3 seasons (2019 cover/catch, 2024 cover/catch). Season greenness vs same-crop peers within 5 km: mean percentile 0.38 over 7 years (4 bottom-quartile, 2 top-quartile); weak persistence (A3), treat as season outcomes. Within-field: a stable pattern (year-to-year rho 0.43, 7 seasons); 6% of the field is low-vigour in >=60% of seasons (chance 0.5%), concentrated E. Screen flags (unverified, ~27% in-season precision outside vegetables): 2024 low_peak; 2025 off-peer trajectory."
}