{
 "field": {
  "uid": "ma-115992167",
  "window": "marchfeld",
  "area_ha": 0.67,
  "centroid_lonlat": [
   16.62967,
   48.24376
  ],
  "ref_year": 2025
 },
 "coverage": {
  "years": [
   2019,
   2020,
   2021,
   2022,
   2023,
   2024,
   2025
  ],
  "declared_years": 6,
  "s2_clear_obs_per_year": {
   "2019": 36.0,
   "2020": 48.0,
   "2021": 49.0,
   "2022": 45.0,
   "2023": 37.0,
   "2024": 41.0,
   "2025": 59.0
  },
  "tessera_px": 33
 },
 "history": [
  {
   "year": 2019,
   "declared": "FOOD INDUSTRY POTATOES",
   "group": "potato",
   "embedding_group": "potato",
   "p_declared_group": 0.943,
   "yoy_centred_distance": null,
   "phenology_change": null,
   "declared_change": null,
   "flags": []
  },
  {
   "year": 2020,
   "declared": "WINTER SOFT WHEAT",
   "group": "winter cereal",
   "embedding_group": "winter cereal",
   "p_declared_group": 1.0,
   "yoy_centred_distance": 1.134,
   "phenology_change": true,
   "declared_change": true,
   "flags": []
  },
  {
   "year": 2021,
   "declared": null,
   "group": null,
   "embedding_group": "field veg",
   "p_declared_group": null,
   "yoy_centred_distance": 1.099,
   "phenology_change": true,
   "declared_change": null,
   "flags": []
  },
  {
   "year": 2022,
   "declared": "WINTER BARLEY",
   "group": "winter cereal",
   "embedding_group": "winter cereal",
   "p_declared_group": 1.0,
   "yoy_centred_distance": 1.459,
   "phenology_change": true,
   "declared_change": null,
   "flags": []
  },
  {
   "year": 2023,
   "declared": "FOOD INDUSTRY POTATOES",
   "group": "potato",
   "embedding_group": "potato",
   "p_declared_group": 0.894,
   "yoy_centred_distance": 1.383,
   "phenology_change": true,
   "declared_change": true,
   "flags": []
  },
  {
   "year": 2024,
   "declared": "WINTER SOFT WHEAT",
   "group": "winter cereal",
   "embedding_group": "winter cereal",
   "p_declared_group": 0.998,
   "yoy_centred_distance": 1.4,
   "phenology_change": true,
   "declared_change": true,
   "flags": []
  },
  {
   "year": 2025,
   "declared": "WINTER BARLEY",
   "group": "winter cereal",
   "embedding_group": "winter cereal",
   "p_declared_group": 0.749,
   "yoy_centred_distance": 0.299,
   "phenology_change": false,
   "declared_change": true,
   "flags": [
    "declared vs phenology change disagree"
   ]
  }
 ],
 "rotation_profile": {
  "n_years": 6,
  "cereal_share": 0.67,
  "n_crops": 3,
  "group_entropy_bits": 0.92,
  "max_monoculture_run": 1,
  "declared_changes": 4,
  "embedding_changes": 5,
  "disagreements": 1,
  "percentile_in_window": {
   "cereal_share": 0.92,
   "group_entropy": 0.19
  }
 },
 "management": [
  {
   "year": 2019,
   "sos_doy": 156.0,
   "peak_doy": 211.0,
   "harvest_doy": 246.0,
   "season_len_d": 80.0,
   "n_cycles": 1.0,
   "winter_cover": "ambiguous",
   "winter_green_kind": null,
   "bare_soil_days": 175.0
  },
  {
   "year": 2020,
   "sos_doy": 71.0,
   "peak_doy": 146.0,
   "harvest_doy": 186.0,
   "season_len_d": 105.0,
   "n_cycles": 1.0,
   "winter_cover": "ambiguous",
   "winter_green_kind": null,
   "bare_soil_days": 80.0
  },
  {
   "year": 2021,
   "sos_doy": 176.0,
   "peak_doy": 211.0,
   "harvest_doy": 246.0,
   "season_len_d": 60.0,
   "n_cycles": 1.0,
   "winter_cover": "n/a",
   "winter_green_kind": null,
   "bare_soil_days": 230.0
  },
  {
   "year": 2022,
   "sos_doy": 71.0,
   "peak_doy": 116.0,
   "harvest_doy": 171.0,
   "season_len_d": 90.0,
   "n_cycles": 1.0,
   "winter_cover": "ambiguous",
   "winter_green_kind": null,
   "bare_soil_days": 105.0
  },
  {
   "year": 2023,
   "sos_doy": 161.0,
   "peak_doy": 211.0,
   "harvest_doy": 261.0,
   "season_len_d": 90.0,
   "n_cycles": 1.0,
   "winter_cover": "n/a",
   "winter_green_kind": null,
   "bare_soil_days": 170.0
  },
  {
   "year": 2024,
   "sos_doy": 46.0,
   "peak_doy": 141.0,
   "harvest_doy": 181.0,
   "season_len_d": 125.0,
   "n_cycles": 1.0,
   "winter_cover": "bare",
   "winter_green_kind": null,
   "bare_soil_days": 200.0
  },
  {
   "year": 2025,
   "sos_doy": 91.0,
   "peak_doy": 121.0,
   "harvest_doy": 186.0,
   "season_len_d": 75.0,
   "n_cycles": 1.0,
   "winter_cover": "bare",
   "winter_green_kind": null,
   "bare_soil_days": 255.0
  }
 ],
 "performance": {
  "by_year": [
   {
    "year": 2019,
    "crop": "FOOD INDUSTRY POTATOES",
    "indvi_season": 48.3,
    "pct_vs_peers": 0.6,
    "z_peer": 0.22,
    "peak_ndvi_pct": 0.69,
    "peak_timing_vs_peers_z": 1.01,
    "n_peers": 35
   },
   {
    "year": 2020,
    "crop": "WINTER SOFT WHEAT",
    "indvi_season": 63.7,
    "pct_vs_peers": 0.84,
    "z_peer": 0.98,
    "peak_ndvi_pct": 0.75,
    "peak_timing_vs_peers_z": -0.67,
    "n_peers": 115
   },
   {
    "year": 2022,
    "crop": "WINTER BARLEY",
    "indvi_season": 53.1,
    "pct_vs_peers": 0.82,
    "z_peer": 0.88,
    "peak_ndvi_pct": 0.82,
    "peak_timing_vs_peers_z": -2.02,
    "n_peers": 17
   },
   {
    "year": 2023,
    "crop": "FOOD INDUSTRY POTATOES",
    "indvi_season": 50.8,
    "pct_vs_peers": 0.86,
    "z_peer": 0.86,
    "peak_ndvi_pct": 0.29,
    "peak_timing_vs_peers_z": 1.69,
    "n_peers": 35
   },
   {
    "year": 2024,
    "crop": "WINTER SOFT WHEAT",
    "indvi_season": 70.0,
    "pct_vs_peers": 0.91,
    "z_peer": 1.33,
    "peak_ndvi_pct": 0.72,
    "peak_timing_vs_peers_z": 0.67,
    "n_peers": 86
   },
   {
    "year": 2025,
    "crop": "WINTER BARLEY",
    "indvi_season": 41.0,
    "pct_vs_peers": 0.33,
    "z_peer": -0.59,
    "peak_ndvi_pct": 0.27,
    "peak_timing_vs_peers_z": 0.0,
    "n_peers": 15
   }
  ],
  "summary": {
   "n_years": 6,
   "mean_pct": 0.73,
   "years_bottom_quartile": 0,
   "years_top_quartile": 4,
   "caveat": "field effect is weak (A3 ICC ~0.1) and does not carry across crop changes; read single-year percentiles as season outcomes"
  }
 },
 "within_field": {
  "n_px": 33,
  "n_years": 6,
  "stability_rho": 0.83,
  "split_half_rho": 0.851,
  "persistent_low_frac": 0.212,
  "persistent_low_expected_by_chance": 0.017,
  "low_zone_direction": "SE",
  "terrain": {
   "rho_elevation": 0.44,
   "rho_twi": -0.004,
   "rho_elevation_rotated_null": -0.065,
   "relief_m": 0.6
  }
 },
 "anomalies": [],
 "boundary": {
  "pred_year": 2025,
  "pred_best_iou": 0.022,
  "pred_split": false,
  "pred_block_ratio": 35.74,
  "note": "PRUE delineates field blocks; low IoU with ratio >1.5 = merged with neighbours (A6), not a data error"
 },
 "maci": {
  "status": "PLACEHOLDER: 'MACI time series' undefined; awaiting Julian"
 },
 "evidence": {
  "history": "A1 (rotation AUC, LOYO group acc)",
  "management": "A2 (harvest vs calendar, cycles vs multi-crop, winter-cover persistence)",
  "performance": "A3 (peer percentile; field-effect ICC, crop-change caveat)",
  "within_field": "A4 (zone stability, edge control, binomial null, DEM rotated null)",
  "anomalies": "A5 (blinded curve review; in-season score)",
  "boundary": "A6 (PRUE vs declared)"
 },
 "narrative": "Declared 2019 food industry potatoes -> 2020 winter soft wheat -> 2022 winter barley -> 2023 food industry potatoes -> 2024 winter soft wheat -> 2025 winter barley. Untracked years inferred from embeddings (LOYO group acc ~0.9): 2021 ~field veg. 3 crops in 6 declared years, cereal share 67%, longest same-crop run 1y; 1 declared-vs-phenology disagreement(s). After summer harvest the field was green over winter in 0/2 seasons. Season greenness vs same-crop peers within 5 km: mean percentile 0.73 over 6 years (0 bottom-quartile, 4 top-quartile); weak persistence (A3), treat as season outcomes. Within-field: a stable pattern (year-to-year rho 0.83, 6 seasons); 21% of the field is low-vigour in >=60% of seasons (chance 1.7%), concentrated SE. Vigour falls toward lower ground (rho 0.44 vs rotated-DEM null -0.07, relief 0.6 m)."
}