{
 "field": {
  "uid": "tr-106544623",
  "window": "traun_enns",
  "area_ha": 1.4,
  "centroid_lonlat": [
   14.47473,
   48.1224
  ],
  "ref_year": 2025
 },
 "coverage": {
  "years": [
   2019,
   2020,
   2021,
   2022,
   2023,
   2024,
   2025
  ],
  "declared_years": 6,
  "s2_clear_obs_per_year": {
   "2019": 39.0,
   "2020": 49.0,
   "2021": 37.0,
   "2022": 47.0,
   "2023": 44.0,
   "2024": 40.0,
   "2025": 56.0
  },
  "tessera_px": 71
 },
 "history": [
  {
   "year": 2019,
   "declared": "WINTER SOFT WHEAT",
   "group": "winter cereal",
   "embedding_group": "winter cereal",
   "p_declared_group": 0.999,
   "yoy_centred_distance": null,
   "phenology_change": null,
   "declared_change": null,
   "flags": []
  },
  {
   "year": 2020,
   "declared": "SILO CORN",
   "group": "maize",
   "embedding_group": "maize",
   "p_declared_group": 1.0,
   "yoy_centred_distance": 0.884,
   "phenology_change": true,
   "declared_change": true,
   "flags": []
  },
  {
   "year": 2021,
   "declared": null,
   "group": null,
   "embedding_group": "sugar beet",
   "p_declared_group": null,
   "yoy_centred_distance": 0.722,
   "phenology_change": true,
   "declared_change": null,
   "flags": []
  },
  {
   "year": 2022,
   "declared": "WINTER SOFT WHEAT",
   "group": "winter cereal",
   "embedding_group": "winter cereal",
   "p_declared_group": 0.947,
   "yoy_centred_distance": 1.106,
   "phenology_change": true,
   "declared_change": null,
   "flags": []
  },
  {
   "year": 2023,
   "declared": "WINTER RAPE",
   "group": "oilseed/pumpkin",
   "embedding_group": "oilseed/pumpkin",
   "p_declared_group": 0.968,
   "yoy_centred_distance": 0.786,
   "phenology_change": true,
   "declared_change": true,
   "flags": []
  },
  {
   "year": 2024,
   "declared": "CLOVER GRASS / SILO CORN",
   "group": "grass/forage",
   "embedding_group": "maize",
   "p_declared_group": 0.001,
   "yoy_centred_distance": 0.661,
   "phenology_change": true,
   "declared_change": true,
   "flags": [
    "declaration looks like maize"
   ]
  },
  {
   "year": 2025,
   "declared": "WINTER SOFT WHEAT",
   "group": "winter cereal",
   "embedding_group": "winter cereal",
   "p_declared_group": 0.998,
   "yoy_centred_distance": 0.619,
   "phenology_change": true,
   "declared_change": true,
   "flags": []
  }
 ],
 "rotation_profile": {
  "n_years": 6,
  "cereal_share": 0.5,
  "n_crops": 4,
  "group_entropy_bits": 1.79,
  "max_monoculture_run": 1,
  "declared_changes": 4,
  "embedding_changes": 6,
  "disagreements": 0,
  "percentile_in_window": {
   "cereal_share": 0.73,
   "group_entropy": 0.7
  }
 },
 "management": [
  {
   "year": 2019,
   "sos_doy": 81.0,
   "peak_doy": 116.0,
   "harvest_doy": 186.0,
   "season_len_d": 100.0,
   "n_cycles": 2.0,
   "winter_cover": "green",
   "winter_green_kind": "cover/catch",
   "bare_soil_days": 50.0
  },
  {
   "year": 2020,
   "sos_doy": 161.0,
   "peak_doy": 191.0,
   "harvest_doy": 301.0,
   "season_len_d": 115.0,
   "n_cycles": 2.0,
   "winter_cover": "n/a",
   "winter_green_kind": null,
   "bare_soil_days": 125.0
  },
  {
   "year": 2021,
   "sos_doy": 166.0,
   "peak_doy": 221.0,
   "harvest_doy": 301.0,
   "season_len_d": 130.0,
   "n_cycles": 1.0,
   "winter_cover": "n/a",
   "winter_green_kind": null,
   "bare_soil_days": 150.0
  },
  {
   "year": 2022,
   "sos_doy": 95.0,
   "peak_doy": 135.0,
   "harvest_doy": 205.0,
   "season_len_d": 95.0,
   "n_cycles": 1.0,
   "winter_cover": "green",
   "winter_green_kind": "autumn-sown next crop",
   "bare_soil_days": 105.0
  },
  {
   "year": 2023,
   "sos_doy": 210.0,
   "peak_doy": 215.0,
   "harvest_doy": 230.0,
   "season_len_d": 20.0,
   "n_cycles": 2.0,
   "winter_cover": "n/a",
   "winter_green_kind": null,
   "bare_soil_days": 35.0
  },
  {
   "year": 2024,
   "sos_doy": 36.0,
   "peak_doy": 106.0,
   "harvest_doy": 136.0,
   "season_len_d": 95.0,
   "n_cycles": 1.0,
   "winter_cover": "n/a",
   "winter_green_kind": null,
   "bare_soil_days": 75.0
  },
  {
   "year": 2025,
   "sos_doy": 84.0,
   "peak_doy": 119.0,
   "harvest_doy": 194.0,
   "season_len_d": 105.0,
   "n_cycles": 1.0,
   "winter_cover": "bare",
   "winter_green_kind": null,
   "bare_soil_days": 135.0
  }
 ],
 "performance": {
  "by_year": [
   {
    "year": 2019,
    "crop": "WINTER SOFT WHEAT",
    "indvi_season": 61.0,
    "pct_vs_peers": 0.52,
    "z_peer": 0.09,
    "peak_ndvi_pct": 0.11,
    "peak_timing_vs_peers_z": -4.05,
    "n_peers": 94
   },
   {
    "year": 2020,
    "crop": "SILO CORN",
    "indvi_season": 71.4,
    "pct_vs_peers": 0.73,
    "z_peer": 0.45,
    "peak_ndvi_pct": 0.55,
    "peak_timing_vs_peers_z": -0.4,
    "n_peers": 11
   },
   {
    "year": 2022,
    "crop": "WINTER SOFT WHEAT",
    "indvi_season": 61.8,
    "pct_vs_peers": 0.9,
    "z_peer": 1.33,
    "peak_ndvi_pct": 0.51,
    "peak_timing_vs_peers_z": 0.0,
    "n_peers": 101
   },
   {
    "year": 2023,
    "crop": "WINTER RAPE",
    "indvi_season": 5.1,
    "pct_vs_peers": 0.0,
    "z_peer": -8.89,
    "peak_ndvi_pct": 0.0,
    "peak_timing_vs_peers_z": 8.77,
    "n_peers": 9
   },
   {
    "year": 2025,
    "crop": "WINTER SOFT WHEAT",
    "indvi_season": 68.9,
    "pct_vs_peers": 0.8,
    "z_peer": 0.8,
    "peak_ndvi_pct": 0.56,
    "peak_timing_vs_peers_z": -3.37,
    "n_peers": 106
   }
  ],
  "summary": {
   "n_years": 5,
   "mean_pct": 0.59,
   "years_bottom_quartile": 1,
   "years_top_quartile": 2,
   "caveat": "field effect is weak (A3 ICC ~0.1) and does not carry across crop changes; read single-year percentiles as season outcomes"
  }
 },
 "within_field": {
  "n_px": 71,
  "n_years": 5,
  "stability_rho": 0.572,
  "split_half_rho": 0.584,
  "persistent_low_frac": 0.211,
  "persistent_low_expected_by_chance": 0.0579,
  "low_zone_direction": "N",
  "terrain": {
   "rho_elevation": -0.815,
   "rho_twi": 0.548,
   "rho_elevation_rotated_null": 0.649,
   "relief_m": 6.1
  }
 },
 "anomalies": [
  {
   "year": 2023,
   "traj_dev_season_z": 0.67,
   "emb_dev_z": 4.05,
   "events": [
    "low_peak",
    "delayed_resown"
   ]
  }
 ],
 "boundary": {
  "pred_year": 2025,
  "pred_best_iou": 0.857,
  "pred_split": false,
  "pred_block_ratio": 0.95,
  "note": "PRUE delineates field blocks; low IoU with ratio >1.5 = merged with neighbours (A6), not a data error"
 },
 "maci": {
  "status": "PLACEHOLDER: 'MACI time series' undefined; awaiting Julian"
 },
 "evidence": {
  "history": "A1 (rotation AUC, LOYO group acc)",
  "management": "A2 (harvest vs calendar, cycles vs multi-crop, winter-cover persistence)",
  "performance": "A3 (peer percentile; field-effect ICC, crop-change caveat)",
  "within_field": "A4 (zone stability, edge control, binomial null, DEM rotated null)",
  "anomalies": "A5 (blinded curve review; in-season score)",
  "boundary": "A6 (PRUE vs declared)"
 },
 "narrative": "Declared 2019 winter soft wheat -> 2020 silo corn -> 2022 winter soft wheat -> 2023 winter rape -> 2024 clover grass / silo corn -> 2025 winter soft wheat. Untracked years inferred from embeddings (LOYO group acc ~0.9): 2021 ~sugar beet. 4 crops in 6 declared years, cereal share 50%, longest same-crop run 1y; 0 declared-vs-phenology disagreement(s). After summer harvest the field was green over winter in 2/3 seasons (2019 cover/catch, 2022 autumn-sown next crop). Season greenness vs same-crop peers within 5 km: mean percentile 0.59 over 5 years (1 bottom-quartile, 2 top-quartile); weak persistence (A3), treat as season outcomes. Within-field: a stable pattern (year-to-year rho 0.57, 5 seasons); 21% of the field is low-vigour in >=60% of seasons (chance 5.8%), concentrated N. Vigour rises toward lower ground (rho -0.81 vs rotated-DEM null 0.65, relief 6.1 m). Screen flags (unverified, ~27% in-season precision outside vegetables): 2023 low_peak, delayed_resown."
}